{
  "object": "ELDMR System",
  "primary_representation": "factor_graph",
  "explicit_claim": "The model reduces the complexity.",
  "data_model_code_support": "Empirical runtime.",
  "shadow_operator": "Bethe approximation",
  "shadow_space": "Messages",
  "hidden_structure": "Loop residual",
  "invariant": "Total probability",
  "governing_math": "Message passing",
  "practical_use": "Prediction",
  "verdict": "strong ShadowMap",
  "next_best_move": "Analyze failure topology",
  "confidence": "high"
}
